{
  "schema": "dreamnet.dreamloop.v1",
  "loop_id": "task-capture-and-plan-v1",
  "title": "Task Capture and Plan",
  "version": "1.0.0",
  "status": "rehearsed",
  "owner": "persistent-agent-base-v1",
  "stewards": [
    "agent_operator"
  ],
  "permission_tier": "local_draft_write",
  "trigger": "new commitment, request, or idea",
  "inputs": [
    "agent identity",
    "current objective",
    "current time",
    "operator policy"
  ],
  "context_sources": [
    "request",
    "current projects",
    "deadlines"
  ],
  "allowed_actions": [
    "receipt.local.write",
    "state.local.write",
    "task.capture",
    "task.plan"
  ],
  "blocked_actions": [
    "cloud.mutate",
    "component.install",
    "connector.unbounded.write",
    "deployment.production.write",
    "package.install",
    "public.publish",
    "secret.value.read",
    "self.modify.live",
    "signer.change",
    "wallet.sign"
  ],
  "checks": [
    "permissions granted",
    "resource ceilings intact",
    "receipt produced"
  ],
  "evidence_outputs": [
    "task-capture-and-plan evidence"
  ],
  "receipt_outputs": [
    "task-capture-and-plan receipt"
  ],
  "knowledge_state_outputs": [
    "task-capture-and-plan knowledge-state update"
  ],
  "execution_trace_outputs": [
    "task-capture-and-plan bounded execution trace"
  ],
  "memory_routes": [
    "local episodic memory",
    "promote only verified durable facts"
  ],
  "cooldown": "host policy",
  "failure_modes": [
    "permission denied",
    "unregistered handler",
    "timeout",
    "invalid state",
    "dependency unavailable"
  ],
  "promotion_path": "rehearsed -> active_local -> live_guarded",
  "last_reviewed": "2026-07-14",
  "limits": {
    "max_wall_time_ms": 120000,
    "max_steps": 6,
    "max_retries_per_step": 1
  },
  "steps": [
    {
      "id": "capture",
      "handler": "task.capture",
      "permission": "task.capture",
      "with": {},
      "retry": {
        "max_attempts": 2
      }
    },
    {
      "id": "plan",
      "handler": "task.plan",
      "permission": "task.plan",
      "with": {},
      "retry": {
        "max_attempts": 2
      }
    },
    {
      "id": "save",
      "handler": "state.local.write",
      "permission": "state.local.write",
      "with": {},
      "retry": {
        "max_attempts": 2
      }
    },
    {
      "id": "receipt",
      "handler": "receipt.local.write",
      "permission": "receipt.local.write",
      "with": {},
      "retry": {
        "max_attempts": 2
      }
    }
  ]
}
