{
  "schema": "dreamnet.dreamloop.v1",
  "loop_id": "replace-me-loop-v1",
  "title": "Replace Me Loop",
  "version": "1.0.0",
  "status": "draft",
  "owner": "replace-me",
  "stewards": [],
  "permission_tier": "read_only",
  "trigger": "manual",
  "inputs": [],
  "context_sources": [],
  "allowed_actions": ["runtime.health.read"],
  "blocked_actions": ["wallet.sign", "social.publish", "production.deploy"],
  "checks": ["handler registered", "permission granted"],
  "evidence_outputs": ["health snapshot"],
  "receipt_outputs": ["loop receipt"],
  "knowledge_state_outputs": [],
  "execution_trace_outputs": ["step receipts"],
  "memory_routes": [],
  "cooldown": "manual",
  "failure_modes": ["permission denied", "handler unavailable", "timeout"],
  "promotion_path": "draft -> rehearsed -> active_local",
  "last_reviewed": "2026-07-14",
  "limits": {
    "max_wall_time_ms": 30000,
    "max_steps": 10,
    "max_retries_per_step": 2
  },
  "steps": [
    {
      "id": "inspect-runtime",
      "handler": "runtime.health.read",
      "permission": "runtime.health.read",
      "with": {}
    }
  ]
}
