{
  "schema": "dreamnet.dreamloop.v1",
  "loop_id": "relationship-memory-sync-v1",
  "title": "Relationship Memory Sync",
  "version": "1.0.0",
  "status": "rehearsed",
  "owner": "persistent-agent-base-v1",
  "stewards": [
    "agent_operator"
  ],
  "permission_tier": "local_draft_write",
  "trigger": "after a meaningful interaction",
  "inputs": [
    "agent identity",
    "current objective",
    "current time",
    "operator policy"
  ],
  "context_sources": [
    "interaction summary",
    "existing relationship memory",
    "privacy policy"
  ],
  "allowed_actions": [
    "receipt.local.write",
    "relationship.read",
    "relationship.write",
    "state.local.write"
  ],
  "blocked_actions": [
    "cloud.mutate",
    "component.install",
    "connector.unbounded.write",
    "deployment.production.write",
    "package.install",
    "public.publish",
    "secret.value.read",
    "self.modify.live",
    "signer.change",
    "wallet.sign"
  ],
  "checks": [
    "permissions granted",
    "resource ceilings intact",
    "receipt produced"
  ],
  "evidence_outputs": [
    "relationship-memory-sync evidence"
  ],
  "receipt_outputs": [
    "relationship-memory-sync receipt"
  ],
  "knowledge_state_outputs": [
    "relationship-memory-sync knowledge-state update"
  ],
  "execution_trace_outputs": [
    "relationship-memory-sync bounded execution trace"
  ],
  "memory_routes": [
    "local episodic memory",
    "promote only verified durable facts"
  ],
  "cooldown": "host policy",
  "failure_modes": [
    "permission denied",
    "unregistered handler",
    "timeout",
    "invalid state",
    "dependency unavailable"
  ],
  "promotion_path": "rehearsed -> active_local -> live_guarded",
  "last_reviewed": "2026-07-14",
  "limits": {
    "max_wall_time_ms": 120000,
    "max_steps": 6,
    "max_retries_per_step": 1
  },
  "steps": [
    {
      "id": "read-relationship",
      "handler": "relationship.read",
      "permission": "relationship.read",
      "with": {},
      "retry": {
        "max_attempts": 2
      }
    },
    {
      "id": "write-update",
      "handler": "relationship.write",
      "permission": "relationship.write",
      "with": {},
      "retry": {
        "max_attempts": 2
      }
    },
    {
      "id": "save-state",
      "handler": "state.local.write",
      "permission": "state.local.write",
      "with": {},
      "retry": {
        "max_attempts": 2
      }
    },
    {
      "id": "receipt",
      "handler": "receipt.local.write",
      "permission": "receipt.local.write",
      "with": {},
      "retry": {
        "max_attempts": 2
      }
    }
  ]
}
